<?xml version="1.0" encoding="utf-8"?>
<?xml-stylesheet type='text/xsl' href='http://openlcb.org/trunk/prototypes/xml/xslt/fdi.xsl'?>
<fdi xmlns:xsi="http://www.w3.org/2001/XMLSchema-instance" xsi:noNamespaceSchemaLocation="http://openlcb.org/trunk/prototypes/xml/schema/fdi.xsd">
  <segment space="250" origin="0">
    <name>Default NMRA Functions</name>
    <description>Generic mapping of the NMRA functions</description>
    <group>
      <name>Functions</name>
      <function>
        <name>F0</name>
      </function>
      <function>
        <name>F1</name>
      </function>
      <function>
        <name>F2</name>
      </function>
      <function>
        <name>F3</name>
      </function>
      <function>
        <name>F4</name>
      </function>
      <function>
        <name>F5</name>
      </function>
      <function>
        <name>F6</name>
      </function>
      <function>
        <name>F7</name>
      </function>
      <function>
        <name>F8</name>
      </function>
      <function>
        <name>F9</name>
      </function>
      <function>
        <name>F10</name>
      </function>
      <function>
        <name>F11</name>
      </function>
      <function>
        <name>F12</name>
      </function>
      <function>
        <name>F13</name>
      </function>
      <function>
        <name>F14</name>
      </function>
      <function>
        <name>F15</name>
      </function>
      <function>
        <name>F16</name>
      </function>
      <function>
        <name>F17</name>
      </function>
      <function>
        <name>F18</name>
      </function>
      <function>
        <name>F19</name>
      </function>
      <function>
        <name>F20</name>
      </function>
      <function>
        <name>F21</name>
      </function>
      <function>
        <name>F22</name>
      </function>
      <function>
        <name>F23</name>
      </function>
      <function>
        <name>F24</name>
      </function>
      <function>
        <name>F25</name>
      </function>
      <function>
        <name>F26</name>
      </function>
      <function>
        <name>F27</name>
      </function>
       <function>
        <name>F28</name>
      </function>
    </group>
  </segment>
</fdi>
